review,talks_about
"Poached pear, green apple on the nose, full body with long finish. Great balance. So, so smooth. Just a delicious wine. Great body—you can tell this has rested in the lees. ",talks about taste
"What a day I had! My dive #250 happened and it was the best dive of the first 15 dives, but dive #252 bought a pod (19) of wild dolphins to us! OMG 😱 🐬🐬🐬🐬🐬🐬
Glad I had one more bottle of this wine to celebrate with! Saw 7 seahorses on this trip, so seahorse prop time! And time to dance 💃🏼 
Aromas of lemon, melon, pineapple, and minerals. 
Palate is delicious! It adds in white flowers, salinity, and happiness.
Dry, medium+ body, and crisp acidity.
14% alcohol 
I'm so exhausted 😴",talks about taste
"Pale lemon color; citrus aromas and some peach; medium body with tropical fruit and a slight creaminess on the palate; long finish. Incredibly smooth and delicious wine, fairly complex for a Sauvignon blanc. ",talks about taste
"grassy, a bit dusty, stony, lime, slightly exotic, subtle vanilla touch, algae.
juicy, moderate acidity, crisp, slightly creamy.
exotic fruit, herbaceous with green notes, apple.
rich structural finish, intense, juicy & very concentrated finale. length is great.",talks about taste
"Light straw. 
White flowers, pineapple 🍍 quince, green apple 🍏 lemon curd 🍋 shells 🐚. 
Full bodied, dry, M+ acidity, silky smooth, creamy, full MLF, 18% new oak, 14.8% abv, but balanced and delicious. 
10 K cases made. ",talks about food combinations
"Great Sauvignon Blanc, drunk from a magnum with a couple of years. This isn't built for age like a BDX Blanc, but the large format and a couple of years has definitely added layers.  Lots of tropical notes, with some guava, pineapple, elderflower, orange, and orange peel, with pineapple, key lime, and a little coconut on the palate. Some stone minerality too, and just a little nutty (cashew?) note.",talks about taste
"Merry Edwards 2020 Sauvignon Blanc. Done in French oak with a yeast stir every week for 10 weeks. Light straw color with a nose of honey, honeydew melon, casaba melon & floral.  The drink features notes of honeydew, casaba melon, mango, pear, peach, tropical, pink grapefruit, pineapple & vanilla on a French oak finish. This beautiful, SB will pair well with Asian food, seafood or chicken. A great stand-alone as well. Been a while since I've had a good SB.  4.5 stars.

🎶 David Bowie - Alladin Sane 🎶",talks about taste
"This is a dry mildly acidic wine with notes of citrus, tropical fruit, and light vanilla on the nose. The palate has notes of white peach and mango with wonderful mineral undertones. One of my favorite white wines",talks about taste
"Clear pale lemon in color with medium intensity and notes of grapefruit, candied tangerine peel, and lemon heads. This wine is dry with medium plus acid, medium body, medium minus alcohol, and a medium finish. 90/100",talks about taste
Solid Sav Blanc. Citrus is foremost but oak influence is evident. Pears and peaches primarily with creamy melon and some tropical grapefruit-y zest to finish. 👌🏽,talks about taste
A little young right now but delicious. High acidity with beautiful color and taste. Heavier with slight creaminess. Can't wait to revisit this one in a few years.,talks about taste
"Best Sauvignon Blanc I had in a long time. Feels quite sweet with tree fruit notes (pear, apple) and a nice citrusy finish. Well balanced and smooth, goes in really easy!",talks about taste
"Sauvignon Blanc tasting in Tokyo:  Everyone had this as their second favorite.  A softer palate then the others with melon in the palate nice acidity and a great, somewhat sweet, finish",talks about taste
"My second favorite Sauvignon Blanc ever. Beautiful lemon and citrus notes along with honey and perfect amount of acidity for backbone! Not dry at all, juicy right to the end.",talks about taste
"A truly excellent Californian SB. Subtle honey, peach, lemon, with a nice bit of salinity and minerality.",talks about taste
"A light plus bodied pale yellow white with flavors of citrus, peach, some apple, noticeable minerality, slight cream from malolactic fermentation, and subtle oak flavors.",talks about taste
"I hate Sauvignon blanc.  But ok this is good.  Loads of pineapple, something a little stinky.  Sour and tropical and slightly weird.  Like that dance teacher on the Gilmore girls.",talks about taste
"Pure juicy fruit with a hint of creaminess and a citrus backbone.  Full disclosure: this is consistently my favorite SB.  Whenever I find it on a menu, I order it and have never been disappointed.  ",talks about taste
"Pale green with no rim MEDIUM+LEGS STRONG AROMA grapefruit tropical fruit grass STRONG FLAVOR grapefruit lime mandarin orange earth MEDIUM BODY MEDIUM+ACID VERY LONG DURATION 

Excellent with salmon",talks about food combinations
"Best Sav Blanc ever! I am not a SB fan but this is amazing.  It is spendy, but amazing…not overly citrus, some vanilla.",talks about taste
"A big number and a fantastic SB..  Consumed in Chicago,  I was going to do a great Pinot but none left in stock tonight.. 

Anyway,  beautiful peach and pear,  extended white fruit layers.. ..",talks about taste
"Smooth, minerality, peach, apricot.  Delicious!  Definitely buy it again!",talks about taste
"95; as far as California SB is concerned, this is one to try. Benchmark SB without a doubt.  Lightly oaked, nicely textured body, just the right acidity.  Put it on your list!",talks about taste
Really crisp and wonderful. Peach pear citrus,talks about taste
Forget about the grass and cat urine that so often fill your nose with sauvignon blanc. This is something different and enterily wonderful.,other
"Incredible white wine! I don’t drink much white but this bottle is so welcoming and bright, hints of green apple. @[1|50229936|James Beecham] I think you’d love this Russian River white wine! ",talks about taste
"Unleashed tropical thiol aromatics - smells amazing. Flavors are more well rounded than the aroma would suggest. Smells like an acid bomb, but this wine has impeccable balance.",talks about taste
"Great wine 
 citrus oak tropical pear
Ohh and a sweet citrus finish 
93pts",talks about taste
"Pretty good, balanced, tropical fruits, round, oak is there, good length and complexity. well made Cali sauv.",talks about taste
"A perfect vintage that holds it's florality & complexity. Seek it our if you can find it and the balance between acidity and taste and pallet will not be easily forgotten
",talks about taste
"A new vintage. Light peach, butter, pear, melon and vanilla. Still my favourite Sauvignon Blanc. ",talks about taste
"Merry Edwards has her own clone of Sauvignon Blanc, which imparts a unique palate to her wine. There's a considerable mouthfeel. Tropical fruit and florals on the nose. Modest acid in the finish.",talks about taste
"Grapefruit, vanilla, tropical fruit, citrus, and smooth oak.  This is a special and unique Sauvignon Blanc.  ",talks about taste
"Some pear, pineapple, lemon and apricot, white flowers and stone fruit. Great minerality, creamy texture with a nice clean finish. Very buttery for a sauvignon. Excellent",talks about taste
Great fruit. citrus peach pear tropical melon cream ,talks about taste
"Truly outstanding SB. Nantucket. Deep Mellon, pineapple, complex honey flavors with a medium color, medium plus complexity. ",talks about taste
"Perfectly balanced with tropical fruit, minerality and just a hint of sweetness to balance the acidity. Almost Riesling-like, with far more body than most Sauv Blanc. Outstanding.",other
"Outstanding CA Sauvignon Blanc.  Fresh, nice minerality, bright fruit, refreshing acidity, clean finish.",talks about taste
Pretty good Sauv Blanc…. Not as crisp and acidic as would have imagined…. Some tart on the palate… delicate body!,talks about taste
"Outstanding sauv blanc that rocked us. Full bodied, wonderful nose. A definite splurge but WOW. If you can, treat yourself. ",talks about taste
"Benchmark Sauvignon Blanc!🤩👌🏻🍷

In a perfect condition to drink.
Classic California styled without green bell pepper and asparagus notes.
A delicious oak touch with a hint of vanilla.",talks about taste
Pear lemon flint ,talks about taste
"I was told Merry Edwards hated making this wine. Too bad she is clearly a genius and the hate doesn’t show. Might be the most well balanced Sauvignon Blanc I’ve ever had, with notes of ripe peach, melon and guava. Lemon peel in the back. Yum!",talks about taste
