review,talks_about
"Good acidity, balance, rounded body and lots of fruit. Lovely minerality, citrus and stone fruits",talks about taste
Pineapples and creamy.,talks about food combinations
Best SB in the entire New World. ,talks about value for money
Beautiful. I thought the 2018 was significantly better than the 2016. This brand went a long way to earning my trust back! Will revisit. ,talks about taste
Chef Tre dinner Oct2020,other
Nice melon wine. If you look at the label,talks about taste
"Creamy, very smooth, very low tannins , not fruit forward , lovely ",talks about taste
One of my all time favorites. ,talks about taste
One of my favorite wines. ,talks about taste
"Consistently delicious wine! Stone fruits, round mouthful, medium full body, long finish. ",talks about taste
One of my favorite whites!  Perfect for the summer ,talks about taste
"As Sauv Blancs go....THIS IS STELLER!!!!  Crisp, clean, sugar Brix balanced and worth every dime +",talks about taste
"Interesting, unusual Sauvignon Blanc. Would rather pair it with poultry than with seafood. ",other
"Super clean. Fruity, full bodied, ripe but still balanced with the acidity. Thanks Stephen ",talks about taste
"Smooth, pear, and apple notes. Just delightful ",talks about taste
"Light, great flavor",talks about taste
Delightful sauv blanc. Long and complex. ,talks about taste
Fruit with good acidity. Smooth,talks about taste
Love love love 💗 SB with a long finish and such complexity ,other
"Simply delicious summer fare.  However, similar quality available from down under for much less $. Enjoy.",talks about taste
"had the 2019. pretty solid sauv blanc— had nice balance and reasonable complexity without too many vegetal elements. got notes of carmelized pear, hay, lemongrass, and crisp green apple. some ML occurred, as i felt it on the palate and in the slight butter flavors. however, not worth $50.",talks about taste
Had in Vegas - just tasted since I ordered for everyone.  Sweeter. On the floral side.  Good for wine newbies.  Not overly complex.  Not boring though.  Fruity bouquet and pleasing to the masses. ,talks about taste
"Flavors of tropical fruit are dominant, but also melon, pear, lemon, floral honeysuckle, and definitely spent some time in oak with butter and sur lie with that creaminess.",talks about taste
"Beautiful Sauvignon Blanc with intense, ripe fruits. Citrus, mango, pineapple, balanced 
",talks about taste
Wonderful fruit forward very drinkable wine!,talks about taste
"4.7
The king of CA SB! I’ve loved the 2019 vintage from high quality producers and Merry Edwards doesn’t disappoint! Rich lemon oil, apricot, honeysuckle. Smooth like a Chablis!",talks about taste
"Medium-bodied, off-dry and aromatic, melon, peach, lemon, kumquat, vanilla, chamomile, cotton candy, white flowers, marshmallow, butter, white pepper, cream, straw, oak",talks about taste
"Smooth,  but seems sweet for a sauv blanc.  Very light lemon,  lower acidity, melon,  butter,  pineapple,  easy to drink,  chicken picatta made this taste sweet",talks about taste
Merry Edwards and happy kwanza! This bomb ass dank ass (BADA) slashes the palette with orange PEEL and lemon PITH. Don’t get your citrus anatomy twisted,talks about taste
Has a sweet note though finishes more dry. In a pinch seems okay but not my favorite!,talks about taste
Still luscious and delicious it has a great lemon Crisp pear ,talks about taste
"Floral, vanilla, melon, orange, clementine, pineapple, lychee",talks about food combinations
citrus peach pear tropical melon cream Wauv! ,talks about taste
Smooth! Surprising SB! Epic French Dinner 2023,talks about food combinations
"Interesting sauv blanc, drinks like a chardonnay",talks about taste
USeX2 tasting citrus oak peach pear tropical melon cream butter ,talks about taste
Very good. Not sure how an SB is going to rate more than 4 starts from me.  citrus tangerine,other
Apple pear mint. Easy going white. ,talks about taste
"Clean opening, slowly creamy aroma of honey appears. At Enoteca after shopping.",talks about taste
Silky smooth with a beautiful light nose. What a SB should be when it isn't a grapefruit bomb.,talks about taste
"pear
green apple
zest",talks about taste
"Red, white and blue tasting. Lightly oaked. Tropical fruit.",talks about taste
"Floral, bananas, great easy to drink",talks about taste
"Wet grass on the nose with hints of lemon, honeysuckle, and cantaloupe. Nice wine.",talks about taste
"Very well made
 citrus peach tropical pear minerals
Excellent quality to price ratio",talks about value for money
Drank Sept 2023 at California Grill: Pear and tangerine,talks about food combinations
"Phenomenal aperitif. Sour gasoline on the nose with unripe citrus fruits. Finish has medium acidity but a surprisingly subtle, creamy finish. ",talks about taste
"Incredible Sauvignon Blanc. Honeydew melon, nectarine, some hints of lime and some kind of hazelnut notes. Just really enjoyable",talks about taste
Wow! Green apple with citrus and mineral undertones with very nice balance and smoothness. Not tart at all. Will definitely stock up on for summer ,talks about taste
"CA SB probably does t get better than this. Medium bodied and elegant with lemon tart, nectarine, and tropical fruit. Pricy for SB but worth it.",talks about taste
"Wine 2...

First RR SB and what an experience.  Oak with SB, so interesting.  Complex, buttery, lemony, straight up delicious!",talks about taste
"Always top quality Sauvignon, but at a premium. Citrus on the nose leads to creamy pear, honeydew and grapefruit. Intoxicating.",talks about taste
Amazing SB. Finishes with some strong minerality with a melon ball.  Get a juicy stone fruit in there.  Not green apple.but citrus,talks about taste
"Citrus zest on nose, medium body, dry, acidic, complex palate.  Outstanding Sauvignon Blanc for a good price.  Merry Edwards rocks!  93/100.",talks about value for money
"An exquisite wine.  So much floral and fruit aromas.  Not the usual grassy nose that is common for the varietal. A very classy, elegant wine. ",other
"Beautiful as always. Perfect with so many foods, especially on Valentine's. This wine never fails to impress. Merry's  version of SB is sublime. ",talks about taste
"Golden color, nose is fruity. Just trying a small sip. Very smooth, very crisp. Beautiful notes of various apples. Absolutely delicious.",talks about taste
"Crisp green apple and pear. Picked up on some oak notes. Reminiscent of a Chardonnay. Delightful, well balanced wine that leaves you wanting more. ",talks about taste
Never thought Sauvignon Blanc could be this sophisticated. An eye opening experience and reminder of how you can be humbled. ,other
"Bright citrus scents: lemon, maybe grapefruit.  Lemon and tropical fruits--grapefruit or dragon fruit.  Crisp and brightly acidic. ",other
Best California Sauvignon Blanc.  Medium gold color Balanced with melon citrus and hint of grass  Reminds me of my favorite French Sancerre ,talks about taste
"I can't praise this one enough. Great citrus and flowery nose, and similar palate. No grassiness at all. Went very well with a scallop crudo. ",talks about taste
"Pale yellow color, lemon & honeydew on nose, fruity, peach with mineral, lovely brightness, roundness on finish, well balanced medium body white.",talks about taste
The perfect Sauvignon Blanc. A bit sweeter than traditional SB but offsets the medium-plus acidity. Dry and tart. Fan. Fukn. Tastic. ,talks about taste
Mayfair las vegas,talks about value for money
"Bright , Meyer lemon infused , smooth finish ",talks about taste
Vanilla oak lemon grass mineral peach stonefruit pineapple ,talks about taste
"Fresh and expressing
Cheers!",other
 Very crisp and delightful.  Would recommend to anyone ,talks about taste
"Fruta and floral on the nose. Balanced, complex and nice lasting.  Loved it",talks about taste
Such a great and intensive SB,talks about value for money
"Very nice with fairly bold body. Tropical fruit, definitely some butter notes and with a mineral finish.  Very nice and complex. ",talks about taste
Soft finish. Not too strong in any direction in terms of flavor profile.,talks about taste
"Smooth. Low pleasant acidity. Nice yellow color. Notes of citrus, minerals, apple, stone, a little oak. Nicely balanced and enjoyable.",talks about taste
"Subtle and refined. Papaya and brûléed grapefruit, touch of honeysuckle. Delicious. ",talks about taste
"Apple on the nose, citrus, green apple, and sherry on the palate.",talks about taste
Wow. Best Sauvignon Blanc I can remember. Really fresh melon lychee. I’ll look to buy this again. ,talks about taste
Toasty and delicious similar to a good chardonnay,talks about taste
I enjoyed this 2020 just as much as the 2018. Lovely fruit with a beautiful creamy and oily palate and a long finish.,talks about taste
"Very smooth, Melon, pear, citrus , vanilla, grapefruit. Two votes of 4.4 and 4.3. Dinner at La Gare in Santa Rosa.",talks about taste
"Consistently great. Had this at the Mazzeos’ house for a poker night in 4.28.23, with them and Janice. Great night!",other
"Top notch! Apple, pear, and lemon notes on the nose. Ripe pear flavors and slight citrus up front. Buttery and smooth with minerals and floral in the middle and end that are just right. This paired beautifully with wood-fired pizza, arugula and cauliflower. Highly recommend.",talks about taste
"Pale straw colored and showing nice viscosity in the glass it wafts aromas of lemon chiffon. The nuanced yellow apple, starfruit, bell pepper, honeysuckle & white pepper flavors on the palate show with lean lightly salted mineral in excellent balance. This medium bodied wine is set with medium acidity, finishing with a tiny glint of hazelnut. Bx92, ws95",talks about taste
"Ripe, rich, and enticing. Plenty tropical aroma with a a uniquely nutty twist and extra heavy mouthfeel from new oak fermentation and lee aging. The weight of the wine is reflected by the weight of the bottle (thick glass for extra effect). Bring this wine to any dinner party, your guests will be impressed.",talks about taste
"Pale lemon in appearance
Nose: pronounced aromas of grapefruit, gooseberry, grass, papaya, apricot, honeysuckle, vanilla and yogurt 
Palate: off-dry (has a touch of RS), medium + acidity, medium alcohol, medium body with a creamy mouthfeel, pronounced intensity of flavors that confirm the nose, long finish 

Outstanding wine, drink now. 
Less .2 because ~$50 can get a lot of great wine outside of Sauvignon Blanc.",talks about taste
"The aroma is compelling, virtually reaching out and grabbing our attention. Yellow peach, melon, guava and crisp Fuji apple are accented with hints of tropical mango and pineapple. Lime, Minneola tangelo and orange blossom lend citrus notes. Accents of dry summer grass, vanilla-toned panna cotta and toasted crème brûlée create complexity. ",talks about taste
"Straw yellow. Lovely aromatic peach, pear, apricot, cinnamon nose. Sweet stone fruit palate. Medium plus body, firm acidity, smooth finish. The common Sauvignon blanc clone is blended with 30% Sauvignon musque, giving it higher residual sugar to support the sweet experience.",talks about taste
"Straw in color, and notes of pineapple, tropical fruit, lemon zest, and a hint of oak. Extremely well balanced with slight acidity. Notes of citrus, tropical fruit, pineapple, and a hint of vanilla from the oak. Amazing California Sauvignon Blanc",talks about taste
"THE BEST SAUV I’VE EVER TASTED. Holy schmoly!!!! A knockout of a wine. Oaky and buttery, has some beautifully seductive caramel toasty notes…but also passion fruit, rose and hints of honeysuckle. showstopper. Oooh! Mind blowing. 🤯",other
"Clear Lt lemon yellow. Clean, delicate juicy apricot mineral. Lt body med-acid Lt alcohol. Fresh bright mid. Long mineral lemon finish. 100% neural French oak. 6-8 month surlee. Very tasty delicate unique fume blanc. ",talks about taste
Very floral on nose and palate. Pale straw hue with prominent Lily of the Valley perfume and baby’s breath. Moderately acidic with cantaloupe melon and peach coming through. Well rounded in body and mouthfeel.,talks about taste
"One of the most buttery Sauvignons I’ve had. Plenty lime and green apple, passion fruit, and peach coming to the front palate. Summer cut grass and herbaceous notes of green bell pepper. Not the most frugal buy but for that special one - she will absolutely love it.",talks about taste
"Fantastic, it has undertones of oak but still has that classic SB flavor, it’s really well balanced and smooth: a truly unique Sauvignon Blanc ",talks about taste
"Amazing wine. Easy drinking, full of flavor, and refreshing. Tangy. Hints of butter. Peaches. Crisp apples, like the crunchy kinds. Spiced vanilla. Really good. ",talks about taste
"Absolutely insane glass!
Not at all what you think when you say Sb.
Completely liquid gold, melted in the mouth.
Notes of: citrus fruit, oak, cream, honey.",other
"What a beautiful Sav Blanc
Crisp and a hint of sweetness probably from the white peach 🍑 hints
Learned at the winery that they make 10k cases of this wine 
Loved it",talks about taste
citrus oak pear peach tropical melon lemon,talks about taste
"Truly delicious, made in the classic old- world style.  Beautiful balance of fruit and acidity.  A real treasure from the Russian River!",talks about taste
"Dry white with honey, apple and minerality. Very good",talks about taste
Had at Bully Boy with oysters and tuna wraps. It was amazing. ,talks about food combinations
@ butter butter citrus oak ,talks about food combinations
Great 💖,talks about taste
"Top notch sauv blanc, stone fruit and citrus notes, but a balanced sweetness contributed to a higher than expected abv at 14% - notes of honeysuckle",talks about taste
2/13/24 Leigh Ann B brought to book club night at our house. E & I enjoyed w/ caviar on V-day.,other
"Round soft mouthfeel - much smoother than the average Sauvignon Blanc. Very smooth with notes of pear, lemon and maybe apricot. Lovely wine! ",talks about taste
"Absolutely loved this - husband splurged on an anniversary wine and this was delicious! Don’t expect a NZ because this is from Cali; does bear some resemblance but is bright, smooth, and well balanced. Try this!",talks about taste
"Straw Color in the glass. Floral, Spices, Vanilla, Stone Fruit and Honey on the nose. Peach 🍑 Pear 🍐 and Ripe Honey Dew Melon 🍈 on the palate. Lime Peel, Orange Peel, Peppery Spices and a creamy long Finish This is ..My favorite SB from California....",talks about taste
"Fuller bodied Sauvignon Blanc that explodes with flavor, while retaining a crispness and levity that you’d hope to experience from a top quality SB. Apricot, peach, pear and lemon curd notes most prominent. ",talks about taste
"On the Sauvignon Blanc spectrum, falls between the stone fruit driven and the tart tropical fruit driven types. More like a white Bordeaux- well balanced, a degree of minerality. Rather high ABV, but not evident in the palate. Very pricey. P246",talks about taste
"Delivers year over year and this is a staple for me. This is a ripe, plump & juicy SB with big complex flavors. Fragrant aromas of ripe peach, pear, lemon, pineapple, honey, vanilla & honeysuckle. Palate is lush with creamy melon, peach, guava, lemon grass, butter & mango citrus curd. Finish is long with soft minerality, honey & light spice. This is such a huge flavor unique SB with creamy textures & paired perfectly with Thai chicken noodle soup. Dry, med+ body & med+ acidity. Pale yellow color. Excellent quality!",talks about taste
"The 2021 Merry Edwards Sauvignon Blanc from Russian River Valley is made to pair with cold asparagus soup. It has everything: pale straw color; crisp acidity; slight creaminess from 4 month sur lie in 18% new French Oak; and most importantly, a complex bouquet. Bouquets of tropical fruits like mangoes and pineapples initially but also has citrus and honeydews at the end. Just a lovely way to celebrate spring. Had at DCA restaurant student banquet",talks about taste
"Lemon, tropical fruits and a touch of vanilla on the nose. Easy drinker and just the right amount of acidity. Ripe Mellon, pineapple, pink grapefruit and a nice touch of minerality. Not your classic sauv blanc but delicious none the less!",other
"ASTOUNDING

One of my top Sauv Blancs, this stuff is just a damn treat whenever I open it. I call this the secret weapon from the Queen of California Pinot. Paired with scallops & lemon parmesan risotto with broccoli, always amazing. Don't get so distracted by bulls at the rodeo that you don't check out ponies like this one!

The creamiest mouthfeel paints the palate with flavors of grapefruit, tangerine, honeysuckle & lemon pulp
Insane integration. 93 pts",talks about taste
"4.3 I just love this wine.

Although this is the last vintage where they sourced fruit from non estate vineyards. This gives much more fruit characteristics than the estate vineyards. From 2019 on, it will be more mineral driven. I prefer the fruit with this one, so buy the 2018s while you can! This does see French oak for fermentation, 18% new. 6 months on lees.

Fresh acidity with med+ body, sumptuous mouthfeel.
Guava, peach, spicy pear, lemon zest, and chalk.

Delicious.",talks about taste
"Peaches and tropical fruit. Some oak and butter, like a Chardonnay for some reason. Otherwise, very concentrated with decent body",talks about taste
"4.3. Not as good as 2018 but still the best Sauvignon Blanc from USA. Tropical fruit, caramelized apple, and grass. Well done!",talks about taste
"Fruit, intense honey initially, buttery with more citrusy fruit/nectar emerging in the middle…dry and crisp…light bodied…amazing wine…",talks about taste
"Yum. Cantaloupe, guava, pineapple, lavender honey, elderflower, baking yeast, cream. Medium bodied with a nice oily texture and high acidity. Long finish. A little bit of heat at 14%. Very nice.",talks about taste
"Aromas and flavors of guava, pineapple, candied fruit and exotic spices.  100% oak but extremely well integrated.  My wife took a half bottle with her on her business trip.  ",talks about taste
"New fish last night for me  ( Monchong 🐟) if your keeping a fish count. 😉.  Shrimp too in bamboo 🍃 

Big Merry Edward’s fan so when this was on the menu.  Yes please. 

Big style Sauvignon Blanc ( barrel fermented ) with richness and creaminess ( lovely with coconut rice)

Lots of tropical nuances ( guava and mango) with a citrus focus.  Light sprinkling of baking spices. Nice thick white to match the array of food flavours.  This 🍷 can age but still a treat early.  Mahalo",talks about taste
"91pts. 95WS 
Wine spectator what were you smoking ? 
Fermented in barrel with bottanage and using special clone of SB
Smooth. Rather intense flavors of pineapple, marmalade honeysuckle and honey melon 
Medium plus acid with a touch of residual sugar and good amount of oak  dairy and brioche 
A good finish 
But not amazing",talks about taste
"Stone fruit, melon, restrained citrus, with oak and cream notes. Fuller body that most other expressions of this grape. Very interesting and drinkable.",other
"One of finest sav blanc I hv tasted . Balanced acidity , fruity and balanced sweetness",talks about taste
"Peach, butter, cream, grass. Not as herbaceous as other savy bs I’ve had recently because of the oak influence but definitely a cool spin on the grape. ",talks about taste
"Perfect. Nose, first taste, like fairy dust blown in your face.Balanced acids with floral notes, Gorgeous color. At the Bull & Bear in the WA.Glides down your palate.",talks about taste
Outstanding California sb.  Medium body medium plus acidity. Outstanding flavors of pear melon mango tangerine lemon grapefruit  cream butter grass saline minerality ,talks about taste
Floral scents.  Good fruit flavors with a balance of minerals that leave a slight pinch in the cheek on the swallow.,talks about taste
"Approaching Condrieu levels of elegance combined with approachability. Super fruity, super delicious, super super. Tropical like a New Zealand but with touches of oak that California can’t resist. There is almost certainly some RS but it is still dry and refreshing while being expressive. Beautiful wine. Peach and citrus with honey and minerals.",talks about taste
"Unlike any Sauvignon Blanc I've had before and this is why - ""We use a specific mix of clones – two-thirds Shenandoah (Clone 1) and one-third Sauvignon Musqué – that results in a wine brimming with floral and tropical fruit aromatics with a citrusy, juicy core. Barrel fermentation and twice-weekly lees stirring help us create the characteristic creamy texture and rich body"". Dry, medium to medium+ acidity with medium+ to full body and 14% abv. On the complex palate, creamy tropical fruit and pineapple (continued)",other
"Despite the mentions of pear, I mostly get melon and pear notes throughout, with a bit of a buttery taste and smooth finish at the end. Fairly long flavor profile. Really tasty wine, would buy again. Worth the price. ",talks about taste
"Really good wine. Worth the money, oak, gooseberry, starfruit, pear, white flowers, cat pee, pineapple, butter. Very complex. I’m not a Sauv blanc guy but with the oak and malo this is like a very aromatic white burgundy.",talks about value for money
"Pale golden in color, nice long thin legs; aromas of peach, melon, guava, pineapple, honeysuckle & grass on the nose; flavors of pear, grapefruit, apple, lime zest, cream & minerals on the palate with a kiss of almond; off-dry, medium body, moderate acidity, medium tangy finish; very smooth yet complex SB, crisp & refreshing with only slightest hint of oak, amazingly delicious with a great mouthfeel, one of the best SBs I’ve had. ",talks about taste
Lovely complex and expressive Californian Sauvignon Blanc citrus oak pear tropical peach melon cream butter grapefruit lemon pineapple vanilla minerals apple honey stone green apple honeysuckle stone fruit apricot lime grass mango guava tangerine straw white peach toast nectarine passion fruit chard banana caramel honeydew melon orange asian pear cantaloupe papaya hay meyer lemon lemon curd kiwi pepper,talks about taste
"Soft and elegant with low acidity. Citrus notes layered with butter and oak. Long, delicious finish. As much as I enjoyed this wine, I've had other SB for less than half the price that were just as good. ",talks about taste
"Deserving of it's reputation. Pale lemon hue with a medium nose of vanilla, jasmine and apricot. Heidi von Der Mehden has overseen things since Merry retired and the decision to barrel-ferment adds a lush complexity to this that I think gets overlooked by sauv lovers.

Acidity is medium-high, softer as one might expect and with those creamy tones more often fund in chardonnays. 

Vanilla again in the pallette along with crisp minerals and tart pear at the end. Pricey? Maybe, but worth it. It's a unique wine. ",other
I want to give this 5 stars but holy cow this is an incredible wine. Beautiful mouthfeel and the fruit is harmonious. Comes off as off-dry even though its not (a plus for me). Highly highly recommend you go out and try this beauty!,talks about taste
"Pale straw in color. Tropical fruit nose. Crisp Creamy flavors of Mango, Peach, pineapple, Notes of Lemon/Lime Zest. Medium acidity paired with a Salmon Sushi app…On Point!",talks about taste
"PNP. Intense golden color. Coconut cream pie, lemon rind, and subtle pear. Dry and very creamy palate. Soft, but persistent acidity.",talks about taste
"Fantastic. Much more depth and complexity than most SBs around the traps, while still staying fresh, bright and fruit forward. A real winner ",other
"Dry, crisp Sauvignon Blanc from a favorite producer. Baked apple, floral, hints of oak, long supple finish. Enjoyed with seafood lunch",talks about taste
This is my favorite Sauvignon Blanc! A beautiful tropical beach in a glass... hints of pineapple and maybe tangerine blossoms. Delicious! ,talks about taste
Beautiful golden color with nose of lemon grass pine needles and vanilla. Well balanced body with taste consistent of the nose.,talks about taste
"Crisp, bright acidity with limestone and cut grass.  Finish is all stone fruits, peach and pear, and goes on and on.  Wife's favorite SB.",talks about taste
"Stunning bouquet of melon, tropical fruit and pear! Fresh spice and subtle citrus on the tongue! Bright acidic finish! Instant favorite!",talks about taste
"This is a fascinating wine.  I get honeyed peach and tropical fruits, a bit of minerals and lime.  Lovely rich body.  A top class SB, for sure.",talks about taste
" 
Fresh and spicy right up front. With a very long and layered end. Rich with baked apple pineapple peach and citrus. Finishing clean and acidic! 

",talks about taste
Unlike any other Sauvignon blanc I’ve tasted and I’m general not a fan of sav blanc. Has a richness and a bit of sweetness. A standout. Tasted at winery in 2023,other
Amazing wine.  The fruity and creamy nature of the grape takes over your palate from the first sip.  Gorgeous white. ,talks about taste
Quaffable! Oaked SB - somewhere btwn a Sancerre and a Napa chard. ,talks about food combinations
A delicious Sauvignon Blanc outstanding- oak pear peach melon butter fantastic!,talks about taste
"Delicious. Citrus on the nose.  Flowers and soft minerals at first sip.  Goes a little flat at the end, but overall excellent.  I see why it’s highly reviewed.  ",talks about taste
"As good as I remember. Barrel fermented Sav Blanc. Lovely palate of banana, peach, orange blossom, lemon, vanilla and hint of honey. Medium bodied palate adds some beautiful toasted oak and spice notes. A unique and complex SB that always delivers!",talks about taste
