review,talks_about
Beautiful bright wine.  Light blond almost clear color.  Smeels of kettle corn crisp but not green.  Sweet floral flavors.  Quick finish that is clean and effortless.  Ripe sweet citrus ends with a nice supple ending. ,talks about taste
The best Sauvignon blanc I've ever had. A hint of oak with a lot of pear and nuttiness. Very fruity and complex. A lot of flavors. Nice with a heavy sauce or a buttery fish. Will absolutely get this again. It is not to b passed up.,talks about taste
We love Merry's Pinot's now I can add this fabulous Sav Blanc to my list of summer go to wines. The light Oak infusion is a wonderful touch and really takes this wine to a new level. We drank this a Bouchon's in Yountville and it's was a perfect pairing to my grilled Swordfish dish. Top marks to Merry for another wonderful masterpiece.,talks about taste
"A lovely if somewhat overpriced Sauvignon Blanc. This vibrant wine has a delicate floral fragrance of jasmine, honeysuckle, fruit blossoms, along with orange and lime zest. On the palate, fruit flavors donate with citrus and stone fruit, including white peach, nectarine, pink apple, and pear. For complexity, notes of fresh sweet bread, hazelnut, and dried flowers. Long finish that opens into notes of grapefruit. Nice minerality, some acidity. Elegant overall. Pair with salads, fresh dishes, and lite fare. ",talks about taste
"Amazing sauv blanc.  Really different.  Tropical feuits Nd melon heavy up front with a bit of that musty barnyard thing and some lemon grass.  Long lingering finish with medium plus acid.scott white, thanks for sharing.",other
"I usually don't prefer Sauvignon Blanc, but this wine is exceptional! Pale yellow in color with light tears. Nose of tropical citrus fruits, including pineapple and lemon, with an incredible floral element. More ripe citrus fruits on the palate, alongside pear and light mineral. The wine is well-balanced, with flavors and acidity in delectable unison, and offers a medium (-) finish.",other
"This is an amazing sb. Something between NZ sauvignon blanc and Californian. The nose is beautiful with herbaceous aromas. Palate is smooth and velvety with oak, butter and lovely tastes. Very surprising wine!    ",talks about taste
"Absolutely excellent Sauvignon Blanc! This wine is a crisp, straw color. The nose is extremely effervescent with notes of pineapple, citrus, and other tropical fruits. There is moderate acidity present. The taste is quite fresh, reminiscent of a warm summer afternoon by the beach in Santa Monica. We see lots of citrus fruits, peaches, and pineapple notes. This is a medium bodied wine with a nice finish. Definitely recommend! ",talks about taste
"Tastes more like a big Napa oaked Chardonnay. Peach yogurt, apricot, butter, saline. Bright acidity that integrates nicely in the creamy tree fruits that dominate. Pale/medium gold. Reminds me of the ZD Chardonnay.",talks about taste
"Straw colored. Full, ripe, and complex with tropical notes of melon and pineapple dominating over white citrus. Rounded out with floral notes of honeysuckle and a pleasant oak influence. This is a beautiful wine.",talks about taste
"Happy International Sauvignon Blanc Day!!Fruity and juicy, tropical nose, medium bodied and medium acidity, 14.1% ABV.  Pineapple, key line, peach and vanilla notes. I'm not a big SB fan but this one I could drink all night long! Paired well with jumbo lump crab cakes, roasted Yukon gold potatoes and grilled asparagus. Yum yum. ",talks about taste
Beautifully unique  Sauv Blanc with a grapefruit citrus and honeysuckle nose accented with great acidity. Rounded feel with a smoothness between a NZ Sauv Blanc and a traditional Sancere. Soft fruit makes it a pleasure to drink!,other
"There are bright but delicate aromas of green grass, grapefruit, melon and herbs. The palate is medium bodied with balanced notes of sweet tropical fruits and a crisp herbal, citrus acidity. Even three years old, this white is still drinking beautifully! A cellar-friendly Sauvignon Blanc for sure! ",talks about taste
"The pour is liquid gold and the nose is just as lovely - some oak smoothed out by melon and a whiff of fresh-cut flowers.  The opening and closing notes are remarkably smooth. There is some size and a bit of butter here, so I'd go with poultry over fish as accompaniment. The quality is undeniable.",talks about taste
" This pale straw colored Sauvignon Blanc from Merry Edwards opens with a very faint banana and delicate cantaloupe bouquet.  This wine is full bodied, balanced, round and rich for a Sauvignon Blanc. Flavors of mild vanilla and cream soda blend with a hint of lime, melon, and honey. The finish is dry and fades away nicely. 92 pts.",talks about taste
"Freshly cut grass is attenuated by a pleasant mix of kiwi, lime and tarragon. Medium bodied the expression of fruits on the palate included limestone, lemon oil, white peaches and elderflower. A lovely aperitif to sip on a sunny day sitting on the patio. Savour the subtle flavors and let the aromas speak to you. We felt transported by this wine with a green bean and asparagus salad with almond. This is not a wine you’d quaff down with food in heavy sauce. 93pts",talks about taste
"Drank for Mother's Day. Light yellow straw in color. Nose of peach, pear and green apple with some mineral notes. Tastes of green apple, pear and peach. Refreshing tartness and acidity. Buttery finish and mouthfeel like a California Chardonnay. As the wine opens up it develops honey notes. Very nice wine from a consistent excellent producer.  Currently my favorite sauvignon blanc. ",talks about taste
"Might be the best Sauv Blanc I've had to date. #InstantClassic
Nectarine, apple and lemon as the foundation with gripping minerality and traces of vanilla.

Elegant and dare I say graceful...... Bring on the warm weather, lobster rolls and evenings by the fire-pit.",talks about taste
"Succulent and juicy , with sweet, fresh baby- pineapple, lime, papaya and candied pink grapefruit peel flavors that sing with purity and focus, set on a supple frame and featuring fresh acidity that weaves in and out.
For all the intensity this shows an effortlessness and elegance!",talks about taste
I’ve never had a winery tasting end with a Sauvignon Blanc but in this case it works:  zero citrus and ample pear & peach  makes this a non traditional dessert wine.  It’s an amazing achievement:  6 months in used oak create a unique experience ,other
"This may be the best SB i've tasted till this date.  For someone who dislikes the SB in general,  this wine is a game changer.  Perfect acidity.  Doesn't have an excessive grapefruit or passion fruit aroma overpowering.  Has a bit of density to it, giving it a bit more chunk. Finishes with a briny mineral touch.  This is no poolside sipper !  Pairs beautifully with greasy foods.",other
"Very aromatic, with ripe stone fruits and dense tropical essences on the nose. Dry, the palate is rich and fruity, dominated by nectarines, peaches, mandarines and just some grassiness. Slightly oaked taste, well balanced by its high acidity and ripeness. The finish is dry and citric, makes it a great complement to any sea seafood. A note of caution, the bottle goes down very fast. ",talks about taste
"Fresh and fruity flavors of pineapple and tree fruits. Golden color featuring amazing aromas. Compares with the best New Zealand SB out there. Appreciate the medium bodied,crisp acidity with oaky undertones ",talks about taste
"Aromas of pear, melon, grapefruit, mango, and vanilla. Creamy mouthfeel, with flavors of stone fruit, lemon, pineapple, and mineral on the finish. Beautiful Sauvignon Blanc! 60% Sauvignon Blanc, 40% Sauvignon Musqué. ",talks about taste
"This white wine is on the fruity and has a pale yellow color. It's very easy to drink 😬.  Has aromas of ripe melons, minerals, and peaches. On the palate is complex with a fruity punch of apricots, nectarines, and peaches. ",talks about taste
"The 2018 is better now it has another year of age in the bottle. The best bottles we've had have always been at least 3-4 years old. We plan to cellar a few bottles and try them 4,5 and 6 years in the bottle. Wouldn't try that with any other SBs, but fairly certain the Merry Edwards will improve with a few more years than the basic SB.",other
"Fantasic Wine with ahí te Pizza!
AIS-91
To be paired with a Puros de Hostos Comendador Box Pressed Toro 20-20.
Very harmonious and superbly balanced. 
 citrus peach grapefruit melon minerals green apple stone wild iris 
¡Salud and enjoy!",talks about taste
"THANK YOU BETH!!

This was such a generous gift Boy a wonderful person I met through Vivino. One of my fav grapes in a different Style. 

Shiny yellow with golden hues. This is a heavier Style than I am used to. Med+ body and 14% vol. 
Scents of lemon, pineapple and papaya. Really juicy mouthfeel with an exotic touch. Tangy acidity but at the same time nearly a creamy texture. Long limey and fresh finish with some herbal notes. 

Stunner wine by a Pinot queen 😊",other
"- 5 Vineyards
- 6 months in oak (sur lie)
- Absolutely killer. Bright, ripe fruits of green apple, pear, grapefruit, stone fruit, minerality, creamy mouthfeel (thanks to sur lie), beautiful and very long finish. Best Californian Sauvignon Blanc I've tasted.

Tasting sample",talks about taste
"Tied with Mark David's Transitus as the best sauv blancs I've had. They managed to take a varietal I generally regard as simple with limited variation that attempts to win the crowd with sweetness, and made it into a sleek, finessed version that tamed the fruit and made this a serious wine. Reminds me of the new serious white zin trend, I could get used to more sauv blancs being made like this.",talks about taste
"An extremely well composed white Californian wine. Nice fragrance of jasmine, and honeysuckle. The palate is dominated by citrus, stone fruits and minerality. An exceptional fresh and delicate wine. I was introduced to this wine at a Danish restaurant. It is impossible to get this brand in Norway and Sweden (State monopoly in both countries). If anybody knows where to get hold of this wine please let me know. This wine got 93 points by Wine Spectator.

Highly recommended
             
Cheers my Vivino friends
",talks about taste
"The Merry Edwards booth was a highlight of the wine show. There were six Pinot Noirs, a Chardonnay, and this outstanding Sauvignon Blanc. The addition of 30% Sauvignon Musqué gave this wine a completely new dimension, with notes of honeysuckle, cantaloupe, ginger, and white peach. A wet gravel minerality gave it some solid structure to balance the forward fruit. Far and away the most unique SB I've ever had. Worth every penny! ",talks about taste
"Last ME I had was the 2015. This is equally as good! Great SB with a wonderful balance of minerality, a citrusy fruit  forward taste and acidity. RRV never disappoints. This drives more to a feel of France than anything else produced in The USA. ",talks about taste
"Unusually rich and full-bodied Sauv Blanc - Russian River Valley does not disappoint.  High in alcohol at 14.1% but no trace of burn.  Moderate oak, smooth vanilla, caramelized pear.  Very, very good and terrific value.",talks about value for money
"This has been one of my favorite Sauvignon Blanc's.  To the nose,  citrus and a slight floral aroma. The hits you right away, plenty of peach, apricot and pear flavors. A nice touch of lemon (and I'm not a lemon fan. A very nice dry finish and definitely a touch acidic with these fruits. A very good SB!!",talks about taste
"Most Sauvignon Blancs are dry, boring, and uneventful—not this one! This is the first wine of this grape that I’ve enjoyed in a while.",other
"Light golden color with a nice nose that is soft, smooth and fruity on the palate, accenting the food flavors and recalling the sometimes cool sunny slopes of the Russian River Valley. Love this Sauvignon Blanc and it’s genius wine maker Merry Edwards. ",talks about taste
"Flashy and high - great Sauvignon Blanc!!! Low reflex almost light yellow clear. Odors of floral discreet perfume. Start gives a nice tingle on the toungue even though acidity isn't high. Very smooth going down and elegant aftertaste with some hidden citricity remaining in mouthtaste. Fresh and crisp. A plus also for the price, very fair.",talks about value for money
"A pronounced floral bouquet.  The glass opens with a taste of sweet cherry, followed by melon accented with lemon.  The finish is slightly sweet, accented with honey.  Strong acidity and minerality throughout.  An outstanding Sauvignon Blanc!",talks about taste
"2017 Sauvignon Blanc - lively and tropical on the nose. Pineapple candy, ripe nectarine and white peach. A little yeast influence with the time on lees giving a little more richness rather than imparting taste. A great balance on the palate. Soft mango fruit and a rounded texture. Excellent 92pts not sure I’ve ever given a new world Sauv Blanc a higher score. ",talks about taste
"Visiting again one of my favorite wineries from California; the Mary Edwards Sauvignon Blanc 2014. 100% Sauvignon Blanco and Sonoma county the wine has scents of oak, pineapple, peach, and persimmon. Flavors of oak, pineapple, vanilla, and persimmon. Everytime I visit this winery, I buy a case of this wine. I also keep a library of the 2014 - Present Day. My recommendation? Buy it!",talks about taste
"Really excellent SB that lived up to the hype. It has a distinctively plush and rounded mouthfeel that is outstanding, but doesn’t sacrifice any of the typical SB crispness. I wouldn’t go so far as to say I taste peach and stone fruit, but there is a beautiful melon aspect that tames the citrus. Easily the best Californian SB I’ve ever had - pleases both traditional SB enthusiasts and Chardonnay fans who prefer more body. ",talks about taste
"Big, bold and almost chardonnay, but with a very citrusy finish. Grapefruit, and possibly pineapple flavors give way to a brashness and dryness that screams chard, but begs you to drink more, until it's gone. Will she for years to come, but is plenty ready now. Picked up at the vineyard and I wish I had more.",talks about taste
"On the nose:
Apple cider, honey, light vanilla.

On the palette:
Balanced perfectly, tongue coating. Lemon, honey, oak, vanilla. 

From a non sav blanc lover, this is the best sav blanc I’ve ever had.",talks about taste
"I’m a rookie at the Sauv Blanc, however if they are all like this, I’m all onboard.",talks about taste
Crowd pleaser.  Peach. Citrus.  Medium body.  On the dryer side. ,talks about taste
Fantastic.  Soon to be Mom’s favorite wine.  She just doesn’t know it yet.,talks about taste
This is the best Sauvignon Blanc from California That I have ever tasted,talks about taste
Cream and peach man,talks about food combinations
"floral, slightly sweet, goes well with fish ",talks about taste
"Great Sauvignon blanc nose, but not the typical grassy acid afterbite.",talks about taste
A great summer wine. Crisp and not overly fruity or grassy,talks about taste
Very unique and smooth,other
Yummy floral musque clone sauce blanc very unique and fun to drink with cheese,talks about taste
"Super fruit. Peaches, strawberries
Not too acidious",talks about taste
Beautiful Sav Blanc. Very distinguished palate,talks about taste
Always fantastic Cali SB. ,talks about taste
"Really great. Fruity, clean, applet, crisp.",talks about taste
"Clean, crisp and dry!  Ultimate fish, chicken and white pasta pour!",talks about taste
"Agree great vine, but not S. B. Authentic .",other
"Thicker, smoked citrus, bruised citrus, tropical, green apple, pineapple",talks about taste
"Very nice, floral nose, light and crisp with slight pear and oak",talks about taste
"Great solid sauv, super zesty ",talks about taste
Pale yellow and opaque rim. Smells of grapefruit. Full body Sauvignon blanc. Taste of apricot in the back with a nice finish.,talks about taste
"4.3 lychee, guava, tropical fruits. Smooth and vanilla, acidic, but not aggressively so. ",talks about taste
"Aromas of stone fruit, and tangerine. Smooth and very drinkable. I would definitely order again. ",talks about taste
very well ballanced with the right seafood will bring out the magic,talks about taste
Amazing and gentle Sauvignon! Nothing to dislike!,talks about taste
Drinking amazing right now. Wow! ,other
Just what the doctor ordered on a 108 degree day!  Outstanding Sauv!,talks about taste
Crisp with layered floral notes and light fruit. Multi-faceted but not heavy.,talks about taste
This ins great! Quite different. ,other
A really beautiful wine — peach and grapefruit with nice minerals and stone fruit on the finish. ,talks about taste
Ive been a Marlborough NZ Sauv Blanc guy and am still learning about the good California Sauv Blancs.  But i can say this one is excellent!,talks about taste
Tropical fruits and some oak in the nose and on the palate. Lush long finish,talks about taste
"Peach, pineapple, pear, floral, fantastic with spicy food.",talks about food combinations
Merry makes a mean Sauv Blanc,talks about taste
"Stunning. Full bodied with a grassy nose and a palette loaded with melon, grapefruit, lime, creamy pear and ripe peach on the long crisp finish.",talks about taste
Amazing. Floral. Warm citrus in the mouth v,talks about taste
"Orange blossom, clean and slight minerality on the finish.",talks about taste
"Pear and melon with a slight oak finish, very good mouth feel for a sav blanc.",talks about taste
"Beautiful full mouth feel, long finish",talks about taste
Rivals my love of the Marlborough NZ Sauvignon Blanc. Nose of peach. Honeydew melon and peach with low acidity. Excellent late night treat.,talks about taste
Peach pear and nice minerality. Great finish a,talks about taste
"Maybe the best SB I've ever had. Pears, melon, hints of apple and lemon blend together in layers of flavor that just keep coming. Just terrific.",talks about taste
"White gold color; nose of yellow flowers; palate smooth, buttery honeydew melon on the long finish. Surprisingly un-grassy.  ",talks about taste
"Beautiful roundness, buttery, slight fruit and slight sweetness bring this white wine together to a delicious, fruity finish.",talks about taste
"Love this! Perfect for a summer day by the pool! Nice mouthfeel, and a slight creaminess.  Tropical notes as if I am on a beautiful Caribbean beach.",talks about taste
"Big and round, tropical fruits, melon, pear, super balanced with great acidity, loved it!",talks about taste
"Excellent a great example of what a Sauvignon Blanc should be. Fruity, elegant and crisp. Consistent top performer, Marry has it down. ",talks about taste
Not overpowering. Not a blanc fan in general but this was magnificent. ,other
Wow. Delicious. Smooth; rich with the brightness of a savignon blanc,talks about taste
"Excellent white—rich, but not overdone, fruity but balanced with mineral, and distinctive.",talks about taste
OMG - best  Sauvignon blanc believe I have ever had. My quest is now to find more. ,talks about taste
"Enjoyed this wine with a fish oriented small plates meal at the Easterly restaurant in St Thomas on 2/19/22. Absolutely delicious. Well balanced, not overly minerally or likely, or flinty but just great. Love it. ",talks about taste
Buttery yet silky smooth with vanilla and spice ,talks about taste
"unusual, yummy sauvignon blanc with incredible oaked-aged fruit flavors.  best fresh and a bit below ambient temperature.  must try, at least to compare to.  drink it regularly if you can afford it.",other
"An interesting and delicious sauv blanc. It has the brightness and acid of a sauv blanc (typical notes like melon and peach) but the fullness and opulence of a refined chardonnay. The oak comes through as an undertone, not a confection. Would buy a case if I could find it!",talks about taste
"Blind, I thought this was Viognier. It’s very floral, ripe, with a creamy, round texture you rarely see in Sauvignon Blanc. It also has lower acidity than what I would expect from Sauv Blanc, but enough to mostly balance out the opulent fruit. This isn’t typical by any means, but it’s fun and complex. Drink now ",other
"I'm already back for more of this Sauvignon Blanc (and I'm not big on whites generally). I'm enjoying like I'd normally a good red, and GF likes it too. So, rich and flavored.  Must chill, tho. It's pricey, but a treat. It's pushing 5* in my book.",talks about taste
"Really something. My favourite California white thus far, by far. Not the crisp sav blanc I’m used to with the NZ wines, but much richer. A bit sweet, but a very complex flavour that goes through a few twists and turns before leaving you with a nice touch of sour and bitter — in a good way.",other
"Light, refreshing and yes delicious ",talks about taste
Lovely. Had with French laundry tasting menu,talks about taste
This may be the perfect Sauv Blanc. The nose is light and lemony but a medium body on the palate. Notes of citrus upfront with a finish off melon rind. A very well-balanced acidity and dryness.,talks about taste
Best Sav Blanc on the market ,talks about value for money
Unreal as always. Loved it. So well balanced and dynamic. ,other
Cold Spring wine store. Amazing stand alone full bodied alcohol forward Saudi gnome Blanc goes great with lemon tarragon chicken.  Yes!,talks about taste
"Great floral notes.  Tropical fruit and full bodied sb, yet the right amount of acid to balance ",talks about taste
"Liquid cocaine. White Cherries, orange blossoms. Creamy nectarines. Wow.",talks about food combinations
"Bright, creamy, and smooth. Notes of pear. Slightly crisp. Delicious. ",talks about taste
Buttery and delicious. Citrus and melon flavor. Some heat from 14.1% alc,talks about taste
"Full bodied citrus fruit, with rich honey and oak like a Chardonnay. Delicious",talks about taste
Excellent blanc. Delightfully refreshing wine. Drank 2018 bottle in 2020.,talks about taste
"Nose: peach, apricot cotton candy, 
Mouth: mineral, sea salt, pear",talks about taste
Amazed at how well this ages. Our favorite us sauv blanc,talks about taste
"Very Nice Wine. Tasty, Calm and elegant in all ways",talks about taste
Rich fruit. Wonderful nose. 93,talks about taste
"One of my all time favorites. Medium body, great mouthfeel, citrus, wet stone. One of my favs. ",talks about taste
Crimson wine group dinner,talks about taste
"Pear, Mellon, good acid. A great pairing with sushi. ",talks about taste
Great. More muted due to the bottle aging I suppose. ,other
Fantastik sauvignon 93 point,talks about taste
"Lemon and stone fruit on the nose smooth well balanced, great acid.",talks about taste
Wow! Wow! Wow! Who oaks a Sauvignon Blanc? Love it,talks about taste
A real treat at this price with a citrus tang and great for the next 15 years,talks about value for money
Before flight home to Moscow perfect!,talks about value for money
Very drinkable and elegant.,talks about taste
Oaked sav blanc.  Very unique and enjoyable ,other
"Barrel fermented in neutral oak; weekly battonage; creamy, floral, fruity, lime, full body; good with Thai food or spicy food.",talks about taste
Great refreshing wine with pear and melon flavors ,talks about taste
Excellent white with a balanced acidity.,talks about taste
About as good as a sauv b gets. Bold ripe fruit.,talks about taste
Very rich. Balanced. ,talks about value for money
"Ooohhhh yum. Dangerously good. Crisp, citrusy. ",talks about taste
This wine is still drinking great! Paired well with Northern Thai spices too!,talks about taste
"One of the yummiest crisp whites I’ve tried. Thought about giving a 4.5, but decided naked people on the label make this a perfect 5.0 :)",talks about taste
"Beautifully put together, creamy lush cantaloupe and green fruit with refreshing acidity; ebullient, tropics meets an English garden",talks about food combinations
"Fantastic,  unique and my all-time favorite",other
Nice balance with yellow aromas ,talks about taste
Another excellent vintage of this benchmark sauvignon blanc.,talks about taste
"Perfectly balanced. Smooth, ripe fruit character with acid throughout. Lemon, lime, ripe apple. ",talks about taste
"Elegant nose with light veggie hues, nicely zesty@palate.",talks about taste
"Very different Sauvignon blanc, rich, nice oak, peach, smooth.",other
Absolutely amazing. So smooth with almost no detectable acidity!,other
Aromas of rich peachy fruits and floral notes. Creamy texture on the palate with a nice acidity. More of an exotic style Sauvignon blanc from Russian river! ,talks about taste
"After visiting the winery earlier this year, we decided to pop a bottle of this lovely juice and reminisce.  Ahhh...just as pure and tasty as the memory.",talks about taste
"Undertone of oak, lemon citrus, a bit sweetness; a great wine for the summer, light and fresh. Better to enjoy with meal. Lack of complexity by itself ",talks about taste
"Terrific Sav Blanc. Nice acidity and great mouth feel. Very complex with plenty of fruit, tangerine, grapefruit and melon. Floral on the nose. Highly recommend.",talks about taste
"Just the perfect Sauvignon Blanc. Extremely floral nose. Full of peach, apricot, pineapple. Just the right amount of citrus. Nice minerality. Enjoyed at the Modern.",talks about taste
Been awhile since I have some ME Sav Blanc but her juice is wonderful. Love the light sweet notes (Apple and peach) as well as a good balance of citrus/acidity ,talks about taste
"This SB is delicious. Even though I like crisper and more acidic style this one is in its own class. Little creamy and smooth, with some oak notes and mango and citrus.",other
